{
  "$schema": "https://json-schema.org/draft/2020-12/schema",
  "$id": "https://concept-clusters.org/schemas/simplified-puzzle-v1.json",
  "$comment": "Reference copy of the internal schema enforced by modules/simplifiedPuzzleSchema.js (zod, not this file -- see that module's own comment). Kept in sync by hand, not generated; not imported by runtime code. The MCP-published schema is a narrower agent-facing projection: it omits protected provenance, creator/license/source-lineage fields, and the legacy lesson credit while preserving them in stored documents. Repository-owned timestamps and revision metadata are absent and synthesized only at infrastructure or explicit JSON-LD interchange boundaries. Legacy JSON-LD bridge termRole is accepted only at the explicit canonicalization boundary and removed before simplified validation. Category references are stable ids; the authoring server accepts legacy display titles only while reading and canonicalizes them before storage.",
  "type": "object",
  "additionalProperties": false,
  "required": ["id", "title", "category", "clusters"],
  "$defs": {
    "boardLimitWaiver": {
      "type": "object",
      "additionalProperties": false,
      "required": ["waiverType", "puzzleId", "targetId", "approvedLimit", "approvedScope", "reason", "grantedBy", "grantedAt"],
      "properties": {
        "waiverType": { "type": "string", "minLength": 1 },
        "puzzleId": { "$ref": "#/$defs/slug" },
        "targetId": { "$ref": "#/$defs/slug" },
        "approvedLimit": { "type": "integer", "minimum": 1 },
        "approvedScope": { "type": "object" },
        "reason": { "type": "string", "minLength": 1 },
        "grantedBy": { "type": "string", "minLength": 1 },
        "grantedAt": { "type": "string", "minLength": 1 }
      }
    },
    "slug": { "type": "string", "pattern": "^[a-z0-9]+(-[a-z0-9]+)*$" },
    "categoryId": {
      "type": "string",
      "pattern": "^[a-z0-9]+(-[a-z0-9]+)*$",
      "description": "Stable category id, not the category display title. Legacy titles are read-compatible and converted by the authoring server."
    },
    "linkEntry": {
      "oneOf": [
        { "type": "string", "minLength": 1 },
        {
          "type": "object",
          "additionalProperties": false,
          "required": ["href"],
          "properties": {
            "href": { "type": "string", "minLength": 1 },
            "label": { "type": "string", "minLength": 1 }
          }
        }
      ]
    },
    "info": {
      "oneOf": [
        { "type": "string", "minLength": 1 },
        {
          "type": "object",
          "additionalProperties": false,
          "properties": {
            "text": { "type": "string", "minLength": 1 },
            "links": {
              "type": "array",
              "minItems": 1,
              "items": { "$ref": "#/$defs/linkEntry" }
            }
          }
        }
      ]
    },
    "puzzleInfo": {
      "oneOf": [
        { "type": "string", "minLength": 1 },
        {
          "type": "object",
          "additionalProperties": false,
          "properties": {
            "text": { "type": "string", "minLength": 1 },
            "links": {
              "type": "array",
              "minItems": 1,
              "items": { "$ref": "#/$defs/linkEntry" }
            },
            "citations": {
              "type": "array",
              "minItems": 1,
              "items": { "$ref": "#/$defs/citation" }
            }
          }
        }
      ]
    },
    "citation": {
      "type": "object",
      "additionalProperties": false,
      "required": ["title"],
      "properties": {
        "title": { "type": "string", "minLength": 1 },
        "author": { "type": "string", "minLength": 1 },
        "publisher": { "type": "string", "minLength": 1 },
        "year": { "type": "string", "minLength": 1 },
        "pages": { "type": "string", "minLength": 1 },
        "url": { "type": "string", "minLength": 1 }
      }
    }
  },
  "properties": {
    "id": { "$ref": "#/$defs/slug" },
    "title": { "type": "string", "minLength": 1 },
    "category": { "$ref": "#/$defs/categoryId" },
    "puzzleKind": {
      "type": "string",
      "enum": ["topic-based", "vocabulary-context", "trivia-quiz"],
      "description": "Authored puzzle type, independent of category and lensMode. Omit for the default topic-based kind; explicitly use trivia-quiz for a trivia quiz or vocabulary-context for a near-synonym usage puzzle."
    },
    "categories": { "type": "array", "items": { "$ref": "#/$defs/categoryId" } },
    "subcategories": { "type": "object", "propertyNames": { "$ref": "#/$defs/categoryId" }, "additionalProperties": { "$ref": "#/$defs/slug" } },
    "tags": { "type": "array", "items": { "type": "string", "minLength": 1 } },
    "large": { "type": "boolean" },
    "info": { "$ref": "#/$defs/puzzleInfo" },
    "clusters": {
      "type": "array",
      "minItems": 1,
      "maxItems": 6,
      "description": "Vocabulary-context puzzles may have one cluster; topic-based and trivia-quiz puzzles require two to six.",
      "items": {
        "type": "object",
        "additionalProperties": false,
        "required": ["name", "fact"],
        "properties": {
          "id": {
            "$ref": "#/$defs/slug",
            "description": "Derived from name (plain slug, no prefix) when omitted -- a bridge referencing this cluster should predict that value."
          },
          "name": { "type": "string", "minLength": 1 },
          "color": {
            "type": "string",
            "enum": ["teal", "blue", "amber", "magenta", "olive", "brown", "cyan"],
            "description": "Auto-assigned, collision-free, when omitted."
          },
          "fact": { "type": "string", "minLength": 1 },
          "seeds": {
            "type": "array",
            "minItems": 1,
            "maxItems": 2,
            "items": { "type": "string", "minLength": 1 },
            "description": "For puzzles that ask the player to sort terms, normally 2. Required with floatingTerms except on a single-cluster vocabulary-context puzzle."
          },
          "floatingTerms": {
            "type": "array",
            "minItems": 1,
            "maxItems": 6,
            "items": { "type": "string", "minLength": 1 }
          },
          "terms": {
            "type": "array",
            "minItems": 2,
            "maxItems": 8,
            "items": { "type": "string", "minLength": 1 },
            "description": "The complete term list for a single-cluster vocabulary-context puzzle; otherwise an optional ordering override for seeds plus floatingTerms."
          },
          "termInfo": { "type": "object", "additionalProperties": { "$ref": "#/$defs/info" } },
          "info": { "$ref": "#/$defs/info" }
        }
      }
    },
    "bridges": {
      "type": "array",
      "description": "No minimum -- bridges are optional and need not make the cluster graph connected.",
      "items": {
        "type": "object",
        "additionalProperties": false,
        "required": ["term", "clusters", "fact"],
        "properties": {
          "id": { "$ref": "#/$defs/slug", "description": "Derived from term when omitted." },
          "term": { "type": "string", "minLength": 1 },
          "clusters": {
            "type": "array",
            "minItems": 2,
            "maxItems": 3,
            "items": { "$ref": "#/$defs/slug" },
            "description": "2 cluster ids, or 3 for a ternary bridge -- not fragments, not positions."
          },
          "fact": { "type": "string", "minLength": 1 },
          "info": { "$ref": "#/$defs/info" },
          "conceptId": { "type": "string", "minLength": 1 },
          "relationKind": {
            "type": "string",
            "enum": ["dynamic", "foundation", "cross-cutting", "contrast", "continuity", "evaluation"]
          },
          "direction": {
            "type": "object",
            "additionalProperties": false,
            "required": ["kind"],
            "properties": {
              "kind": {
                "type": "string",
                "enum": ["undirected", "through", "bidirectional", "outward", "inward"]
              },
              "from": { "$ref": "#/$defs/slug", "description": "Cluster id; only meaningful for kind \"through\"." },
              "to": { "$ref": "#/$defs/slug" }
            }
          },
          "idealTerms": {
            "type": "object",
            "additionalProperties": { "type": "string", "minLength": 1 },
            "description": "{clusterId: idealTerm} -- only list the clusters worth specifying; keys must be among this bridge's own clusters."
          }
        }
      }
    },
    "lenses": {
      "type": "array",
      "description": "All three lens modes (sequential/assignment/quiz) are representable; which fields a given lens needs depends on the puzzle's lensMode, checked downstream.",
      "items": {
        "type": "object",
        "additionalProperties": false,
        "required": ["id", "prompt", "explanation"],
        "properties": {
          "id": { "$ref": "#/$defs/slug" },
          "prompt": { "type": "string", "minLength": 1 },
          "explanation": { "type": "string", "minLength": 1 },
          "label": { "type": "string", "minLength": 1 },
          "definition": { "type": "string", "minLength": 1 },
          "color": {
            "type": "string",
            "enum": ["teal", "blue", "amber", "magenta", "olive", "brown", "cyan"]
          },
          "targets": {
            "type": "array",
            "items": { "type": "string", "minLength": 1 },
            "description": "Sequential/assignment mode."
          },
          "reasons": {
            "type": "object",
            "additionalProperties": { "type": "string", "minLength": 1 },
            "description": "Assignment mode: {target: rationale}."
          },
          "options": {
            "type": "array",
            "description": "Quiz mode, used instead of top-level targets.",
            "items": {
              "type": "object",
              "additionalProperties": false,
              "required": ["id", "label"],
              "properties": {
                "id": { "$ref": "#/$defs/slug" },
                "label": { "type": "string", "minLength": 1 },
                "correct": { "type": "boolean" },
                "targets": { "type": "array", "items": { "type": "string", "minLength": 1 } }
              }
            }
          }
        }
      }
    },
    "lensMode": { "type": "string", "enum": ["sequential", "assignment", "quiz"] },
    "preSolve": { "type": "boolean" },
    "relatedPuzzles": {
      "type": "object",
      "description": "Player-facing next-puzzle links only. Split-plan boardOrder is external metadata; do not add order or boardOrder here.",
      "additionalProperties": false,
      "required": ["entries"],
      "properties": {
        "info": { "$ref": "#/$defs/info" },
        "entries": {
          "type": "array",
          "minItems": 1,
          "items": {
            "type": "object",
            "additionalProperties": false,
            "required": ["id", "reason"],
            "properties": {
              "id": { "type": "string", "minLength": 1 },
              "reason": { "type": "string", "minLength": 1 },
              "via": { "type": "array", "items": { "type": "string", "minLength": 1 } }
            }
          }
        }
      }
    },
    "learningIntroduction": {
      "type": "object",
      "additionalProperties": false,
      "required": ["requirement", "content"],
      "description": "Only content.text is offered here (not content.src) -- hosted drafts must embed Markdown directly, and a chatbot has no filesystem to point src at.",
      "properties": {
        "requirement": { "type": "string", "enum": ["optional", "recommended", "required"] },
        "title": { "type": "string", "minLength": 1 },
        "summary": { "type": "string", "minLength": 1 },
        "estimatedMinutes": { "type": "integer", "minimum": 1, "maximum": 60 },
        "content": {
          "type": "object",
          "additionalProperties": false,
          "required": ["text"],
          "properties": { "text": { "type": "string", "minLength": 1 } }
        },
        "links": {
          "type": "array",
          "minItems": 1,
          "items": { "$ref": "#/$defs/linkEntry" }
        }
      }
    },
    "boardLimitWaivers": {
      "type": "array",
      "items": { "$ref": "#/$defs/boardLimitWaiver" },
      "description": "Protected human-granted exceptions; accepted only at administrative and publication boundaries."
    },
    "provenance": {
      "type": "object",
      "additionalProperties": false,
      "required": ["contributors"],
      "properties": {
        "collaboration": {
          "type": "string",
          "enum": ["human", "humanPrimary", "aiPrimary", "ai"]
        },
        "contributors": {
          "type": "array",
          "minItems": 1,
          "items": {
            "oneOf": [
              { "type": "string", "minLength": 1 },
              {
                "type": "object",
                "additionalProperties": false,
                "required": ["name"],
                "properties": {
                  "kind": { "type": "string", "enum": ["human", "generative"] },
                  "name": { "type": "string", "minLength": 1 },
                  "provider": { "type": "string", "minLength": 1 },
                  "model": { "type": "string", "minLength": 1 },
                  "reasoning": { "type": "string", "enum": ["light", "medium", "high", "extra", "extraHigh", "ultra", "noThinking"] },
                  "switch": { "type": "string", "enum": ["fast", "thinking"] }
                }
              }
            ]
          }
        },
        "speed": { "type": "string", "enum": ["fast", "normal", "max", "ultracode"] },
        "reviewedBy": { "type": "string", "maxLength": 80 }
      }
    },
    "creator": { "type": "string", "minLength": 1 },
    "license": { "type": "string", "minLength": 1 },
    "derivedFrom": { "type": "string", "minLength": 1 },
    "language": { "type": "string", "minLength": 1 }
  },
  "allOf": [
    {
      "if": {
        "properties": { "puzzleKind": { "const": "vocabulary-context" } },
        "required": ["puzzleKind"]
      },
      "then": { "properties": { "clusters": { "minItems": 1 } } },
      "else": { "properties": { "clusters": { "minItems": 2 } } }
    },
    {
      "if": {
        "properties": {
          "puzzleKind": { "const": "vocabulary-context" },
          "clusters": { "maxItems": 1 }
        },
        "required": ["puzzleKind", "clusters"]
      },
      "then": {
        "properties": {
          "clusters": {
            "items": {
              "required": ["terms"],
              "not": {
                "anyOf": [
                  { "required": ["seeds"] },
                  { "required": ["floatingTerms"] }
                ]
              }
            }
          },
          "bridges": { "maxItems": 0 }
        },
        "not": { "required": ["preSolve"] }
      },
      "else": {
        "properties": {
          "clusters": {
            "items": { "required": ["seeds", "floatingTerms"] }
          }
        }
      }
    }
  ]
}
