{
  "id": "data-probability",
  "title": "Data & probability",
  "category": "math",
  "clusters": [
    {
      "id": "statistics",
      "name": "Statistics",
      "color": "teal",
      "fact": "Statistics summarizes data using measures like mean, median, and range.",
      "termInfo": {
        "mean": {
          "links": [
            {
              "href": "wiki:Mean"
            }
          ]
        },
        "median": {
          "links": [
            {
              "href": "wiki:Median"
            }
          ]
        },
        "range": {
          "text": "The difference between the highest and lowest values in a data set.",
          "links": [
            {
              "href": "wiki:Range (statistics)"
            }
          ]
        },
        "mode": {
          "text": "The value that appears most often in a data set.",
          "links": [
            {
              "href": "wiki:Mode (statistics)"
            }
          ]
        }
      },
      "info": {
        "links": [
          {
            "href": "wiki:Statistics"
          }
        ]
      },
      "seeds": [
        "mean",
        "median"
      ],
      "floatingTerms": [
        "range",
        "mode"
      ],
      "terms": [
        "mean",
        "median",
        "range",
        "mode"
      ]
    },
    {
      "id": "probability",
      "name": "Probability",
      "color": "blue",
      "fact": "Probability measures how likely an event is, from impossible to certain.",
      "termInfo": {
        "outcome": {
          "text": "A single possible result of an experiment or trial.",
          "links": [
            {
              "href": "wiki:Outcome (probability)"
            }
          ]
        },
        "event": {
          "text": "A set of one or more outcomes — \"rolling an even number\" is an event made up of three individual outcomes.",
          "links": [
            {
              "href": "wiki:Event (probability theory)"
            }
          ]
        },
        "sample space": {
          "text": "The full set of every possible outcome of an experiment or event.",
          "links": [
            {
              "href": "wiki:Sample space"
            }
          ]
        },
        "likelihood": {
          "links": [
            {
              "href": "wiki:Likelihood function"
            }
          ]
        }
      },
      "info": {
        "links": [
          {
            "href": "wiki:Probability"
          }
        ]
      },
      "seeds": [
        "outcome",
        "event"
      ],
      "floatingTerms": [
        "likelihood",
        "sample space"
      ],
      "terms": [
        "outcome",
        "event",
        "likelihood",
        "sample space"
      ]
    },
    {
      "id": "graphs-charts",
      "name": "Graphs & charts",
      "color": "amber",
      "fact": "Graphs and charts turn raw numbers into a picture that's easier to read at a glance.",
      "termInfo": {
        "bar chart": {
          "links": [
            {
              "href": "wiki:Bar chart"
            }
          ]
        },
        "histogram": {
          "links": [
            {
              "href": "wiki:Histogram"
            }
          ]
        },
        "scatter plot": {
          "links": [
            {
              "href": "wiki:Scatter plot"
            }
          ]
        },
        "line graph": {
          "text": "A chart connecting data points with a line, typically used to show change over time.",
          "links": [
            {
              "href": "wiki:Line chart"
            }
          ]
        }
      },
      "info": {
        "links": [
          {
            "href": "wiki:Chart"
          }
        ]
      },
      "seeds": [
        "bar chart",
        "histogram"
      ],
      "floatingTerms": [
        "scatter plot",
        "line graph"
      ],
      "terms": [
        "bar chart",
        "histogram",
        "scatter plot",
        "line graph"
      ]
    }
  ],
  "bridges": [
    {
      "id": "sample",
      "term": "sample",
      "clusters": [
        "statistics",
        "probability"
      ],
      "fact": "Sample bridges the two: statistics describes a sample, and probability predicts how well it represents the whole population.",
      "info": {
        "text": "A subset drawn from a larger population, used to make inferences about the whole.",
        "links": [
          {
            "href": "wiki:Sampling (statistics)"
          }
        ]
      }
    },
    {
      "id": "distribution",
      "term": "distribution",
      "clusters": [
        "probability",
        "graphs-charts"
      ],
      "fact": "Distribution bridges the two: it's a probability idea that's almost always shown as a graph, like a histogram's shape.",
      "info": {
        "text": "A description of how likely each possible outcome is.",
        "links": [
          {
            "href": "wiki:Probability distribution"
          }
        ]
      },
      "relationKind": "foundation",
      "idealTerms": {
        "probability": "likelihood",
        "graphs-charts": "histogram"
      }
    }
  ],
  "provenance": {
    "collaboration": "ai",
    "contributors": [
      {
        "name": "Claude (Sonnet 5)"
      }
    ]
  }
}
