{
  "id": "revolutions-modern-world",
  "title": "Revolutions of the modern world",
  "category": "history-society",
  "large": true,
  "clusters": [
    {
      "id": "american-revolution",
      "name": "American Revolution",
      "color": "teal",
      "fact": "The American Revolution overthrew British colonial rule in the name of natural rights and self-governance, founding a republic.",
      "termInfo": {
        "independence": {
          "links": [
            {
              "href": "wiki:Independence"
            }
          ]
        },
        "natural rights": {
          "links": [
            {
              "href": "wiki:Natural rights and legal rights"
            }
          ]
        },
        "republic": {
          "links": [
            {
              "href": "wiki:Republic"
            }
          ]
        },
        "taxation": {
          "links": [
            {
              "href": "wiki:Tax"
            }
          ]
        }
      },
      "info": {
        "links": [
          {
            "href": "wiki:American Revolution"
          }
        ]
      },
      "seeds": [
        "independence",
        "natural rights"
      ],
      "floatingTerms": [
        "republic",
        "taxation"
      ],
      "terms": [
        "independence",
        "natural rights",
        "republic",
        "taxation"
      ]
    },
    {
      "id": "french-revolution",
      "name": "French Revolution",
      "color": "blue",
      "fact": "The French Revolution overthrew the monarchy in the name of liberty and equality, but its radical phase descended into mass executions.",
      "termInfo": {
        "Estates-General": {
          "text": "France's traditional assembly of the three social estates (clergy, nobility, commoners) — its convening in 1789 triggered the Revolution.",
          "links": [
            {
              "href": "wiki:Estates General of 1789"
            }
          ]
        },
        "guillotine": {
          "links": [
            {
              "href": "wiki:Guillotine"
            }
          ]
        },
        "Reign of Terror": {
          "links": [
            {
              "href": "wiki:Reign of Terror"
            }
          ]
        },
        "Declaration of the Rights of Man": {
          "links": [
            {
              "href": "wiki:Declaration of the Rights of Man and of the Citizen"
            }
          ]
        }
      },
      "info": {
        "links": [
          {
            "href": "wiki:French Revolution"
          }
        ]
      },
      "seeds": [
        "Estates-General",
        "guillotine"
      ],
      "floatingTerms": [
        "Reign of Terror",
        "Declaration of the Rights of Man"
      ],
      "terms": [
        "Estates-General",
        "guillotine",
        "Reign of Terror",
        "Declaration of the Rights of Man"
      ]
    },
    {
      "id": "haitian-revolution",
      "name": "Haitian Revolution",
      "color": "amber",
      "fact": "The Haitian Revolution was the only successful slave revolt to found a nation, ending slavery in Saint-Domingue and establishing Haiti.",
      "termInfo": {
        "enslaved rebellion": {
          "text": "An uprising by enslaved people against those who enslaved them — the Haitian Revolution is history's only one to succeed in founding a nation.",
          "links": [
            {
              "href": "wiki:Slave rebellion"
            }
          ]
        },
        "Toussaint Louverture": {
          "links": [
            {
              "href": "wiki:Toussaint Louverture"
            }
          ]
        },
        "Haitian independence": {
          "text": "Declared in 1804, ending French colonial rule and slavery in Saint-Domingue and founding Haiti.",
          "links": [
            {
              "href": "wiki:Haitian Declaration of Independence"
            }
          ]
        },
        "Saint-Domingue": {
          "links": [
            {
              "href": "wiki:Saint-Domingue"
            }
          ]
        }
      },
      "info": {
        "links": [
          {
            "href": "wiki:Haitian Revolution"
          }
        ]
      },
      "seeds": [
        "enslaved rebellion",
        "Toussaint Louverture"
      ],
      "floatingTerms": [
        "Haitian independence",
        "Saint-Domingue"
      ],
      "terms": [
        "enslaved rebellion",
        "Toussaint Louverture",
        "Haitian independence",
        "Saint-Domingue"
      ]
    },
    {
      "id": "russian-revolution",
      "name": "Russian Revolution",
      "color": "magenta",
      "fact": "The Russian Revolution toppled the Tsar and, months later, brought the Bolsheviks to power, founding the world's first communist state.",
      "termInfo": {
        "Bolsheviks": {
          "links": [
            {
              "href": "wiki:Bolsheviks"
            }
          ]
        },
        "Tsar": {
          "links": [
            {
              "href": "wiki:Tsar"
            }
          ]
        },
        "Lenin": {
          "links": [
            {
              "href": "wiki:Vladimir Lenin"
            }
          ]
        },
        "October Revolution": {
          "links": [
            {
              "href": "wiki:October Revolution"
            }
          ]
        }
      },
      "info": {
        "links": [
          {
            "href": "wiki:Russian Revolution"
          }
        ]
      },
      "seeds": [
        "Bolsheviks",
        "Tsar"
      ],
      "floatingTerms": [
        "Lenin",
        "October Revolution"
      ],
      "terms": [
        "Bolsheviks",
        "Tsar",
        "Lenin",
        "October Revolution"
      ]
    }
  ],
  "bridges": [
    {
      "id": "enlightenment-ideals",
      "term": "Enlightenment ideals",
      "clusters": [
        "american-revolution",
        "french-revolution"
      ],
      "fact": "Enlightenment ideals bridge the two: both revolutions drew on the same philosophy of natural rights and popular sovereignty, even as they produced very different outcomes.",
      "info": {
        "text": "The 18th-century intellectual movement that championed reason, natural rights, and popular sovereignty over inherited authority.",
        "links": [
          {
            "href": "wiki:Age of Enlightenment"
          }
        ]
      },
      "relationKind": "foundation",
      "idealTerms": {
        "american-revolution": "natural rights",
        "french-revolution": "Declaration of the Rights of Man"
      }
    },
    {
      "id": "abolition-of-slavery",
      "term": "abolition of slavery",
      "clusters": [
        "french-revolution",
        "haitian-revolution"
      ],
      "fact": "Abolition of slavery bridges the two: enslaved Haitians invoked the French Revolution's own Declaration of the Rights of Man to demand freedom, and the French Convention briefly abolished slavery in response in 1794.",
      "info": {
        "links": [
          {
            "href": "wiki:Abolitionism"
          }
        ]
      },
      "relationKind": "dynamic",
      "idealTerms": {
        "french-revolution": "Declaration of the Rights of Man",
        "haitian-revolution": "enslaved rebellion"
      }
    },
    {
      "id": "provisional-government",
      "term": "provisional government",
      "clusters": [
        "french-revolution",
        "russian-revolution"
      ],
      "fact": "Provisional government bridges the two: both revolutions passed through an initial moderate government before radicals — Jacobins in France, Bolsheviks in Russia — overthrew it and seized full control.",
      "info": {
        "links": [
          {
            "href": "wiki:Provisional government"
          }
        ]
      },
      "relationKind": "cross-cutting",
      "idealTerms": {
        "russian-revolution": "Bolsheviks"
      }
    }
  ],
  "provenance": {
    "collaboration": "ai",
    "contributors": [
      {
        "name": "Claude (Sonnet 5)"
      }
    ]
  }
}
